### ISSUE TITLE
Does not work with goduplicator HA aseko local sends package FIN signal

### ISSUE THREAD

**Issue by Enrica-r** [hopkins-tk/home-assistant-aseko-local#40]
I have the current Version of HA and your current version.

Your integration is working well with a direct connection ASEKO Aquanet --> HA Aseko Local.

Then I installed on a Debian LXC Container with docker your recommended goduplicator. This gets the packages from Aseko Aquanet correctly. The -f forward to Aseko Cloud works well also. But HA Aseko Local gets data few seconds. Afterward there is no update of HA Aseko Local data.

I have seen in goduplicator terminal following error:

```
goduplicator  | 2025/08/13 12:44:36 got error from mirror: EOF
goduplicator  | 2025/08/13 12:44:37 got error from mirror: write tcp 192.168.40.8:35354->192.168.90.18:47524: use of closed network connection
```
This means the connection has been closed. But by whom? duplicator or HA Aseko Local? On HA is address and port 0.0.0.0:47524 still open.

I have installed a docker container with socat. This tool just forward packages.

```yaml
services:
  socat:
    image: alpine/socat
    container_name: socat-aseko
    restart: unless-stopped
    network_mode: host
    command: >
      TCP-LISTEN:47524,fork,reuseaddr
      TCP:192.168.90.18:47524
```
This gives the oportiunity to tcpdump packages without the risk that goduplicator closes the packages. The result is:

```
socat-aseko  | 2025/08/13 13:17:27 socat[23] E read(6, 0x7fc95df52000, 8192): Connection reset by peer
socat-aseko  | 2025/08/13 13:17:39 socat[24] E read(6, 0x7fc95df52000, 8192): Connection reset by peer
socat-aseko  | 2025/08/13 13:17:49 socat[25] E read(6, 0x7fc95df52000, 8192): Connection reset by peer
socat-aseko  | 2025/08/13 13:18:00 socat[26] E read(6, 0x7fc95df52000, 8192): Connection reset by peer
socat-aseko  | 2025/08/13 13:18:10 socat[27] E read(6, 0x7fc95df52000, 8192): Connection reset by peer

Hier ist der TCPdump:
root@docker:/opt/dockge# sudo tcpdump -i any port 47524 -n
tcpdump: data link type LINUX_SLL2
tcpdump: verbose output suppressed, use -v[v]... for full protocol decode
listening on any, link-type LINUX_SLL2 (Linux cooked v2), snapshot length 262144 bytes
15:18:42.272739 eth0  In  IP 192.168.40.86.47524 > 192.168.40.8.47524: Flags [P.], seq 48215:48335, ack 4208266189, win 2920, length 120
15:18:42.272758 eth0  Out IP 192.168.40.8.47524 > 192.168.40.86.47524: Flags [.], ack 120, win 64120, length 0
15:18:42.272919 eth0  Out IP 192.168.40.8.59446 > 192.168.90.18.47524: Flags [P.], seq 2820401874:2820401994, ack 3035589141, win 502, options [nop,nop,TS val 1278052393 ecr 1757059114], length 120
15:18:42.273805 eth0  In  IP 192.168.90.18.47524 > 192.168.40.8.59446: Flags [.], ack 120, win 509, options [nop,nop,TS val 1757068605 ecr 1278052393], length 0
15:18:42.277102 eth0  In  IP 192.168.90.18.47524 > 192.168.40.8.59446: Flags [F.], seq 1, ack 120, win 509, options [nop,nop,TS val 1757068609 ecr 1278052393], length 0
15:18:42.277224 eth0  Out IP 192.168.40.8.47524 > 192.168.40.86.47524: Flags [F.], seq 1, ack 120, win 64120, length 0
15:18:42.278159 eth0  Out IP 192.168.40.8.59446 > 192.168.90.18.47524: Flags [.], ack 2, win 502, options [nop,nop,TS val 1278052399 ecr 1757068609], length 0
15:18:42.281187 eth0  In  IP 220.75.129.0.47524 > 192.168.40.8.47524: Flags [.], ack 4208266190, win 2919, length 0
15:18:42.281211 eth0  Out IP 192.168.40.8.47524 > 220.75.129.0.47524: Flags [R], seq 4208266190, win 0, length 0
15:18:42.281443 eth0  In  IP 192.168.40.86.47524 > 192.168.40.8.47524: Flags [R.], seq 120, ack 2, win 2920, length 0
15:18:42.281555 eth0  Out IP 192.168.40.8.59446 > 192.168.90.18.47524: Flags [F.], seq 120, ack 2, win 502, options [nop,nop,TS val 1278052402 ecr 1757068609], length 0
```
Also socat gets a closing request from HA Aseko Local, but socat autmatically reopens the connection what goduplicator doesn't. I assume the Aseko Aquanet does also. That's why it works directly.

Why does Aseko Local sends the FIN Flag (closing request). Is your goduplicator installation really working?

**Comment by hopkins-tk** [comment]
Looking forward for the PR. I was thinking about that approach as well, but as I did not want to use the re-sending in HA myself (having a small proxy, which will run all the times feels safer to me) I did not bother in the end.

But if you can make it happen, it would be great option to have. As well as the consumption data - I will be happy to help you with the testing on my **ASEKO Salt** unit.
